Comment,Likes
Happy to help film this one! Please don’t ever FaceTime me with your Persona again thanks,21590
"2:43 ""I get off here... Enjoy your adventure!"" was so genuine and sweet.",15972
When you feel like Times Square doesn't have enough screens already,47
"there is a deep and uncomfortable disconnect in what is about to happen. 
simply because we are going to let it happen...
it doesn't end well.",37
I am deaf... I would love something like this to actively make captions for everyone around me so I can tell what people are saying... would be amazing.,3474
"This is the type of review I'm so glad exists 😅

2:05 There's a travel mode in the control settings! Apple says it's made for airplanes but... I suspect it'll do pretty good on subway too",13108
"But... honestly, why is it good that our ""outside"" reality will be bombarded with access to our online worlds? If it's hard enough now to sit in a room with friends and stay focused on ""the now"" and enjoy the moments together, are you insinuating that our future is basically that no moments together will be unencumbered by apps, videos, calls, and augmented reality? Why is that good?",31
This genuinely terrifies me for what’s to come in the next few decades,69
I wanna watch this again in 10-20 years. This gonna be like watching people with their first bulky mobile phones,2398
The cut away of you holding the donut up killed me. LOL.,3016
This will be a great boost for people alienation,6
"thansk for the video, really enjoyed this type of reveiw.",1
That man on the subway with the beautiful blue tie was very sweet “enjoy your adventure” ☺️ 2:29,626
"This is a fun video to watch!

I used it as inspiration for creating a short story about the apple vision pros",0
Casey using iphone se 1st generation makes me happy because i still use mine!! Best phone,5
This was one of my favorite Black Mirror episodes!,799
"What stood out to me is how friendly everyone was. ""Enjoy your adventure"" How amazing is that guy!",1149
"Casey, you are a gem. What a great video, and thanks for saying what I've been thinking.",0
First time watching your channel. I really appreciate the info but what I really loved about this was that - especially at the end when you were giving us your thoughts - you didn't put micro editing cuts after every six words like most Youtubers do today. It was very mature and professional. Thank you.,29
"That gentleman at 2:30 is security for my office building. He’s an amazing guy, what a treat to see him on here",762
"Let me tell you one thing, THIS is the best review that I ever seen about this product. It is a real review in real life. Congratulations and I hope Apple engineers take notes about this video.",827
You always do such a good job,0
Good video bro. Its pretty down to earth while getting others input. I like that.,0
What an incredible way of showing this product off. Not something that you'd see a typical review do. I appreciate your authenticity.,454
This video is going to be so legendary in 10 years,1020
In 30 years when we have this tech in contact lenses this video is going to be a classic. Like the first experience with atari footage,198
"finally, the review we all needed.",1
The butterfly moment killed me 🤣 🦋,8881
"Bro this is why you’re one of the OGs
Because you don’t repeat the same review that every YouTuber does - unbox the device etc - you entertain us through film while teaching us about it. This is a true review!",769
8:57 yeah man this is def a good thing,2
I gotta say this makes me both nervous and excited. I wonder when it gets super clean will by workflow be better more efficient so when I am connected I can multitask better or not be sitting all day. Then when I want to turn it off and be in the real world I can do that too. I already see it now. Real life is something people are actively seeking out. I miss sometimes not being able to “disconnect” the way we used to when we had landlines only. But now that time has passed with computers in our pockets we’re starting to figure out how to give ourselves what we need as humans even whilst we engage fully in the tech. I think we’ll be alright but there will be a learning curve.,0
"""Enjoy your adventure"" 

What a guy. So peaceful and kind. Everyone else feels that, right?",1304
"2:44 I like how when the guy on the train said ""enjoy your adventure,"" a title called Adventure appeared in the apple tv app right after.",390
"u r a good creator man, keep making more videos, thanks🙂",0
Great review thanks man,0
People just staring at you while you say “the butterfly is eating my donut” had me dying 🤣🤣,715
"i feel like New York is like the perfect place to test this. most people will be completely uninterested in whatever you have going on, and the ones who do care will be cool enough characters to include in a video. its like the perfect choice",426
Another visual masterpiece.,0
"I can imagine having one in the day to day life, growing up with one, and revisiting ur home town. Where every day to day moment long forgotten is qued up to view, a video you left running at the bus stop, a map for getting from your house to a once new cofee shop. Instagram posts shwoing up as forgotten memories not based on time of year, but location as you hit each archived benchmark. Pulling up videos of you and your friends, friends you may not have talked to in years, all comes flooding back not just in your mind, but with the media and documentation of those forgotten memories. Ar overlays of new buildings shwoing the floor planes and store fronts of what used to be on that block, a glimpse of the world not just how it is, but how it is remembered.",18
The men in the metro was so kind and respectful.,419
Im fine with the present. Being always connected looks like the best way of being always alone. Boredom is an important human experience and having this will just make us consume content non stop,766
That was a dope Marques plug and shout out,1
Anyone noticed Thansk ? 😂 His review is so authentic. He shows the practical use case of vision pro that no one has shown in any other video. Great 👌,1
"The man who said ""enjoy your adventure"" was so wholesome 2:45",1132
Videos like this are a good reminder of why I love Casey’s videos and story telling ability. Glad he pops up every now and then.,332
About time you  ought up! Can do that with the quest as well.,0
they really need speech to text on this so you're not stopping to type awkwardly.  it's something I've discussed while in one of my classes recently. where we brought up accessibility and when people have issue's with their hands or no hands at all. I think i see a option there maybee? to the far right at the bottom? 3:58 if you pause it but I honestly think it should be better explained or more readily available to those who need it.,0
3:40 imagine taking the subway in one or two years and having to dodge all the zombies who parked in front of you to text  😭😭😭,256
The bizareness of Casey typing on the stairs at 3:45 in the air from the outside perspectice. It just kills me everytime 😂😂,398
Been waiting for a clip from you,0
Cool concept. To many glitch things i was picking up on. I still need to know about trading apps etc.  Others i read said they thought it was cool first week or so then ....,0
"As a tech geek, this is super cool... 

As a human that feel like my phone makes me disconnected from reality... this makes me feel like we are going to get even more disconnected from reality/the present and more connected to the digital world. 

If thats good or bad is up to each and everyone to decide for themselves.",665
"That outside perspective of Casey waving a donut around in the air just going ""The butterflies are eating my donut"" was hilarious 😂",212
Best review/experience out,0
"I agree that this is the future of computing, but also agree that the tech needs to get smaller, lighter, and cheaper, almost like regular sunglasses, just like you said! The day this happens, 🎉",2
“Apple Vision Pro kids” about to replace “iPad kids”??,9041
I’m a simple man. I see a video by this guy and I’m back in 2016 at 20 years old dreaming of an electric longboard… dude the nostalgia you evoked with this…. Thank you. I missed you. Crap I’m crying now.,404
dude @ 2:19 trying to be _sneaky recording Casey_ LMFAOOOOOOOO 🤣🤣🤣🤣🤣🤣🤣🤣,1
"Thanks ,i have one and want to travel right now",0
I already think we're on our phones ignoring the people around us too much. This is just dystopian AF 😂,435
"Haha loved the synchronicity of the guy saying ""enjoy your adventure"" and right after you open Netflix to ""Adventure"". The guy was a wizard 😂",303
It was dope seeing yu at the Sony Creative awhile back…,0
"The most interesting point for me that it is already so good that you get really into it in a so short time…
When I get it right you get the vision, set it up and directly after that you done this video, so just one day and you got already the true feeling of AR…
That’s just amazing cuz that is just exactly what AR should be, the integration from the digital into the real world, that is just the barebone idea of AR and Apple seems to nailed it…
Just impressive…",1
"This is the most original review of the Apple Vision Pro. Everyone is reviewing them in controlled environment, this review was original and provided a totally different perspective on this new emerging technology outside of an office or living room. Nice one!",182
This is hysterical. I laughed so hard at you just standing on the steps poking at thin air 🤣🤣,820
"What a human being u are, the ultimate best",0
"“I get off here, enjoy your adventure!” 😢 im not crying you are😢",269
broooooo the typing at 3:50 killed me 😂,371
"I thought your intro was gonna be you whiting them out like your sunglasses
Would be Iconic",0
"You have to use travel mode if your are moving, otherwise it won't correct for that motion. other than that you could hold on to the window while youre moving",0
"I didn't laugh this much in a long time 🤣 The texting on the steps, the butterfly....",316
"The idea of everyone having some type of device like the Vision Pro in the future is disconcerting. That moment when you’re in Time Square is what stood out to me. There are tons of people around and you’re in an isolated world within the headset. People already interact less with the people around them because of cellphones, and I can only see this getting worse if we’re able to set up an entire office wherever we are. The future looks lonely if this is where we’re headed.",245
I think I'll wait for them to advance the tech but I'm glad it's a success because it means more companies will make more improved versions,0
Y'all did an amazing job at filming the video as if Casey was still filming himself. The style still very much looks like a vlog.,0
"These things make us engage in ultimate dopamine, we're going to become so dependant on these type of things to feel satisfied, and whenever we're not using it, we're going to crave it, that's why it's important to think it through. Acknowledge your surrounding and be aware of what you're doing, meditation is key to not get consumed by the machines.",519
This is the best critique of this experience without actually critiquing it directly with words.,262
"After waiting a week to try it, my husband finally did yesterday (our kid has one). After spending just a few minutes on it, watching the beginning of a movie, he retired to his office to watch something on his t.v. and said, 'well, I'll never be happy just watching anything on a t.v. now.' The first thing I wanted to try (other than the immersive environments which are AMAZING) was to watch a movie on a huge screen. I didn't realize there were theater environments (Disney's is great) and the experience was beyond my wildest imagination. You are seriously IN a theater; there are even 'cupholders' next to you, and floorlights in the 'aisles.' I watched Coco in 3D and, having seen it before on a television, it was a completely different experience and my reaction to it was different. I was more emotionally invested in the story. No distractions. I literally cried (and wondered if I was damaging the vision pro lol). 

But I also opened a book on the device and started reading. I have ADHD and it is rarely easy to focus on a book, but with the pages in front of you and an environment surrounding it to block out distractions, it is much easier to focus on the words and to stay engaged. I can see this helping people with attention issues -- and so much more. Like Casey said, this is the future of computing and interacting with media. It is a truly unique and incredible experience.",42
"A decent review- do they feel like first gen gear? Clunky, slow software?",0
"""enjoy your adventure"" what a nice guy. we need more like him.",72
"5:38 ""it's impossible for me to imagine that you can't see what I can see"" -  that quote right there highlights the awesomeness of this thing. it feels like the 90s all over again where we see this cool new thing and then imagine all the potential.",593
"Wow, of all the review videos I've seen no one has played video. I wanted to find out how video looks like in this. Giid work.",0
"hey, i know this may be a long shot but i am attending stn this year, where i know you will be speaking and was wondering if i’d be able to convince you to help do the morning anchoring for my school at the convention, we could record right before/after your speech! lmk!",0
Master Toyota Technician. A while back they said AR would help a technician work on a vehicle. This would be such a game changer in an industrial setting. When I'm working on an electronic diag I can have my wiring diagram while I work. It would be even crazier if it can illuminate with IR or have a thermo camera to show heat resistance in a wire. This is a game changer. Can't wait for the future.!,187
9:36 he perfectly described future computing in one sentence and a gesture,282
"Sure - I believe you. This may be the future. 

Careful what you wish for.",0
this was so good,0
"I love how Casey showcases the absurdity of this thing, while still being amazed by it.",162
This is by far the best non-review review of this thing. Casey is such an incredible storyteller,366
"what about safety concerns not being able to see corner of your eye or  anything that can impair your vision, did you feel safe?",0
"I've seen a few videos involving these goggles. The main thing I notice that concerns me is the lack of situational awareness the users have. People stopping in cross walks, people stopping on stairs, etcetera.",104
In control center there’s a travel mode which makes it so you can use it in moving vehicles,80
The reaction of people is the best part!,0
casey always has another view on stuff.. thats why i love watching his videos.. thx man for being on youtube !!!,3
"""I get off here ... Enjoy your adventure"" The line was priceless...!! Great non review Mr Neistat, I always love your content..!!",195
"Also, you stopped on the stairwell typing, was gold. I laughed out loud.",409
"Really cool technology with great potential - I saw MS HoloLens years ago - amazing.
BUT, no peripheral vision - really bad idea around the streets - ok at home etc...
It's already bad enough with peeps with headphones - there's so many that have been hit or had near misses with cars/bikes/other pedestrians (I've had several walk almost out in front of me).",0
A great review.,0
It was so funny to watch people stare in pure confusion as he tries to feed his donut to the virtual dinosaur 😂,1952
I love how the family just stares at him @ 6:30. XD,392
"I wish I can experience that thing, or get owned to experience 😁 I love futuristic technology such like that..",0
I love this. AVP vs NYC. Round 1 *ding* *ding*,0
You can always count on Casey to review the Vision Pro in the most _New York_ way possible!  😄,220
Master story teller at work. I was grinning ear to ear throughout the whole video. It is so refreshing to see someone bring a human emotional perspective to a tech review. Thank you Casey. I am grateful I live in the same world as you.,212
The only video anyone needs to watch about the Apple Vision Pro 👏,0
So good!,0
@3:52 Casey typing a text response while stopped on the steps was friggin hilarious.,703
"2:43 It is kinda funny that after the nice guy says ""I get off here... Enjoy your adventure"", Adventure pops up on apple tv hehe",123
This litedally reminded me of the VR guy from the Anime : Lain - Serial Experiments 😂,0
I love watching videos of things I can’t afford 🙌🙌,0
"I love how he compliments his mom, then dismisses her with a slight of hand 🤣🤣  9:35",103
"Many people have said it already, but this is such a big sacrifice to our social nature man. Phones and computers have made society lonely and distant already, can't imagine what something like this would end up doing if it caught on (I still think this will be a huge flop carried solely by channels like this and Marques' but we'll see).
Imagine walking down the street and not needing to ask anybody for any sort of information (still the case with phones but now you don't need to tell your device where you are or take it out etc), constantly being connected to your favorite people so you stop finding value in meeting or talking to new people and no one will even know who or if somebody is looking at them. Your sense of hearing and seeing are connected to an active virtual environment at all times, which we automatically find way more interesting to operate in than real life. Phones don't give us this yet we still pull them out and into our pockets several times for small trips.

I mean just look at this alone, you see a guy walking around, making hand gestures, with everybody around him wondering if he can even see them.",783
"Excellent! I agree with you - Buy Apple Stock instead of the goggles; don’t touch it for 10 years - I’m guessing 100x profit. $400,000 stock growth. But it could be insanely higher - I see home integration being the biggest improvement.  Everyone puts the ipad on the wall now - using it for security systems etc.",2
The three d aspect to the dinosaur coming out of the screen at you was actually part of the coolest saying about it.  .   .   Or maybe just sitting anywhere and pulling up things like you're on your own desktop at home with multiple screens.,0
"Casey answered the questions of the average Joe. 

Unlike any other reviewers, your content is so accessible and easily understood.",428
"This makes me a little sad. I see how cool these are but I also see technology like this making us WAYYY more disconnected with each other. Awesome video, just some thoughts abt the future of technology.",196
"Imagine the power of the advertisements in the future in this! When you're immersed in this experience and your brain starts to take it as the real world, I think that's when you're vulnerable and where advertising is going to aim. That looks mind-blowing to me!!",4
"The amount of use cases for something like this are endless. There are literally so many different ways in which j could imagine something like this being used. I really am looking forward to the feature of augmented reality. I remember years ago when Microsoft took a swing at it with the Hololense, and I've been fascinated by this type of tech since.",0
2:44 is the most genuine i’ve ever smiled at any youtube video,101
That Krispy Kreme scene was too funny. Thanks for making my day.,177
"Simula VR is an interesting looking VR Linux computer that works like that with high resolution display, passthrough, and intel i7 mobile",0
be in THE MOMENT. You do not need ten moments.,2
"I love this take. Rather than fuss over certain details, you have gotten deeper into the heads of the creators and why this is a groundbreaking corner in tech history. This was hilarious but profound!",117
We’re finally catching up to Back to the Future 2,1047
Is it safe while driving a car??  I'll try it on my comute.,1
Absolutely these will evolve to something like a pair of glasses with some kind of wireless power supply.,0
"""Enjoy your adventure"" what a gentleman!!",86
"watching it in action outside of an office room just makes it feel so futuristic, i love it.",46
That Man trying to Grab the Donut thinking you are giving it to him instead of the Dinosaur 😆,1
"One thing people will never say about it. ""You look great wearing it"".",2
the edit on the doughnut shop with Casey's POV of the butterfly versus the reality with the people around looking at him super lost is amazing hahahahahah,90
"Love Marques, but this is the BEST FREAKIN Apple Vision Pro video anywhere. I love NYC. Thanks Casey! This made my day",97
Exactly the video I was looking for. Thanks! Instead of big YouTubers just talking Your video shows the actual usage and the experience. Well done,0
Love from India ❤,0
I'll never get tired of his videos,759
"@caseyneistat what you are referring to, as the future of computing, is a future iteration of Neuralink",0
"This is the actual review, instead of just reading the manual. This has got so much perspective. I can call this piece an ART. Especially the antenna's when he is speaking about the future makes so much sense to me. Great work!!!",17
"As a Gamer like me:
this is first step for the advance future, this really fits well to exercise our body. it saves many people lives!!! absolutely agree for this , hopefully it will happen in few years!!!!!",0
"i think this is better if the hardware is in your pocket, maybe your phone could operate the same IOS.
it needs a wire so why not have the heavy hardware in your pocket.
it could also be wireless i think.",0
"This is like one of the best videos I have seen on Apple Pro yet.  I mean he is actually using it in a day to day setting.  Makes me want one, but at the same time wait till the 2nd gen.  As other have said the future looks exciting.  

However to show a video of Apple Pro in NY! On the Subway! And…..having a huge screen on the tracks with a YouTube video lol hilarious, awesome!👏",111
6:37  When your food is laced with hallucinogenic drugs.,16
"I watched an anime about 15 years ago that was this exact product, but in glasses format with intractable animals running on AI. I knew eventually we'd get there and it looks like it's starting to come together. Just need to somehow shrink everything.",0
"the first video that changed the thought of the vision pro for me is that one guy working at home who gets up to go to the kitchen and theres other windows open for how to cook something by the stove and a grocery list by the fridge, then he returns to his couch with all his work windows.",0
2:52 The window moving away when the train started moving cracked me up 😂,87
Been watching for 10+ years now and it never ceases to amaze me at how charismatic and entertaining you make everything. I love it.,67
Natural selection at work,0
Holding the donut up for the butterfly 😂,0
Seems like we’re witnessing the end of being present and mindful of our everyday moments.   People can barely survive in public without numbly scrolling on the phone.  This takes that dysfunction to a whole new level.,196
Its fun to use for a couple days max. I returned mine because it’s not worth the price and it’s entirely in everyday life.,0
This guy makes New York look like a nice place,1
"""The butteryfly is eating my donut"" idk why but i choked i laughed so hard at this😂😂",183
"Funny you mentioned Marques' review, which was a masterclass, but you captured the remaining insights that he hadn't. Impressive work.",92
"Read the books Ready Player one and Ready player Two. Not only are they entretaining but you can also get a glimpse of what could be the real future of technology. Remember that in 2001 Space Odisey you could see an iPad, in concept. Or with the Dick Tracy movies, that watch he had. The issue would be the effects on regular society, as has social media.",0
"finally, i said this to some dudes from school but they didnt understand. you get it",0
"This might be an unpopular opinion... I like taking in the surroundings and atmosphere. 

I enjoy the daily movement and grind. 

These active VR remind me of
'Wall-e'",93
Not sure if anyone in the comments has mentioned this but there is a travel mode that can be turned on so that apps stay in place.  I’d love to see how it works in a similar environment like a train or car.  Great video btw!,113
"I think that soon apple will sell advertising spaces, creating virtual times-square-like screens and signs that everybody with a Vision Pro could see in the same exact position. Each city could build a virtual ecosystem, integrating the reality. Multiple brands like meta could offer their alternative world, meaning that multiple digital version of the same urban spaces could coexist, or maybe all the companies could convey in one single multiverse. 
This is going to be bigger than what we can even imagine",0
Thank you cassey,0
Casey you have to turn on travel mode! it's in control center you CAN use windows when there is movement,45
"Pretty sure “travel mode” would solve your subway issues of windows floating away. 
Loved your video, love your passion, one of the best I’ve seen on the AVP so far!",141
"Do you still use an iPhone 5 (10:06), i just noticed",0
I'll wait for the Vision Max or Vision Ultra or Ultra Max Thank You.,0
The vision pro seems like such a cool but also potentially dangerous piece of tech. It's interesting to see how it could impact our daily lives and interactions. Definitely a thought-provoking video!,892
6:45 the butterfly's eating my donut 😂😂 dude I'm cry laughing this is somm funny,61
