Comment,Likes
"Apple: Vision Pro
Microsoft: Hololens
both promise the same thing. Only one delivers.",0
Lets make whats inside a video about this and cut it open want to know how it works..,0
this is like the first iPhone,0
The butterfly is eating my donut.,0
Yeah I'm sure people will use this tool to be more social and not at all become more self-centered and shut-in... Great tech but at what cost?,2
6:46 LCD moment,0
Well someone loved NonPlayer,0
"These things are so freaking cool.
I'm really excited to see where we go from here.",0
A year ago you wore the same jacket to test the AI electric shoes. No one is wearing those and no one will be wearing these.,1
"This is as disconnected from the world as it gets. Super sick tho, the tech is wild.",0
"ok.. who is this guy??? why is everyone pumping this guy up, he doesn't even find the right words to describe his experience.. this guy has 12 million followers wtf..",1
The stepping stone to Brain interfaces. No Robocop screen for me thanks. Wearable tech is a precursor to having that tech inside you…,0
I'm worried what this will mean for humans interacting on a human level... It's already hard enough trying to get people to engage and focus on the here and now as it is,0
"…and I’m over here thinkin; at some point soon in the future, there’s only gonna be two types of people in the world when Dad gets back…. 😏",0
Apple vision 3 will sell like hot pancakes. I’ll wait for that.,0
"Technology is getting very scary by the minute, and I don’t know how I feel about it.",0
"Nothing like being online 100% of the time and being completely detached from reality.  No thanks.  That thing is a terrible idea.  I though social media was bad for humanity, this will be a million times worse.  Throw it in the trash where it belongs.",1
"Great review but... Apple knows that cyberpunk stories are cautionary tales, right? Not inspiration?",0
"people will get away more from real life interactions because of things like this,most of us are already salves of smart phones.. its so sad.",0
Lol you know you look crazy when people in NYC are giving you side glances.,0
"Unfortunately, using this in Brazil on the street, thieves steal from you.",0
RIP all other reviewers🎉,0
The butterfly is eating my donut,0
"Damn, this just puts content consumption into a different kind of addiction level. Putting the phone down is such an essential thing to do now, but so challenging for most people. And this? Wtf bye bye actual human connection and creativity from boredom.",0
Isnt this exactly what AR is?,0
dude never used a quest headset b4?,0
What about a person who wears glasses???,0
I’ve been reading & watching reviews and there’s no doubt this thing is awesome but $4k is a hefty price tag. In typical apple fashion they’ve unnecessarily inflated the price of their product.,0
"For all the criticizers: you said the same thing about the radio, the TV, the telephone, the internet, then smart phones, and now you are saying the same thing about VR/AI: that it will ruin society and lead to our doom.  Yet with each evolution in tech, you eventually integrated them into your lives and it has now made us smarter, more connected, more efficient, and more creative then ever before, and this next evolution will only maximize our potential even further.  Embrace it. This is going to allow our dreams to become literal reality.",0
This is wrong on so many levels and dangerous for several reasons. Also I'm curious to see the effect it will have on people after 15 years on the skull shape lmao like headsets have,1
"Imagine when eventually everyone has these, but they're not goggles, they're fuckin CONTACTS. And everyone is wearing contacts that can do all this shit everywhere they go. It's definitely gonna happen in like less than 5 years.",1
I think we are becoming more disconnected just having phones in our hands and this will make it 10X worse! Sad world it is leading to.,0
People are going to become even less good at dealing with reality.,3
"Yeah, this product is like the Lisa, way too expensive but so revolutionary. I'll wait for the ""Mac"" version of this... cheaper and smaller",0
bro use travel mode,0
"Um....legit, your own mind can do this.....this device will level the field of psychosis though.",1
this seems dangerous to have in public. oh your watching a show in front of you and then start walking and you dont see whats behind the thing you are watching. also if you wear headphone you dont ear your surrounding. also you just might get muggged for your  headset. also your periferal vision is reduced also if yoou dont wear air pods your just gonna annoy everyone with your video you are watching,1
"Your video is way better than Marques B's video. I turned it off, it was boring.",0
"- Tech
- Donut
- Butterfly eating donut

All what I wanna say while watching this as a European…. This is America. 😂",0
If people start walking around with these things Everything Will Be Recorded. Everything. All the time.,0
This is absolutely fucking horrifying,5
me watching this on a 7y old tablet :D,0
I still think the quest 3 does rhis better imo,0
Can i watch PINKY XXX ?,0
He’s gotta be wearing his glasses underneath right?,0
Every time I watch a Casey Neistat video I love NYC a little more.,0
"The question…
Why is the real world not good enough for people anymore?",1
"Who would wear these in public?! It’s the new version of A-Holes that would walk around with their giant Bluetooth in their ear. I’m glad they’re balls deep in their devices, means we don’t have to interact.",2
With neurolink its gonna be nuts,0
Can't imagine the world in 500 years from now.,0
*For $3500 Id rather just glimpse at a screen occasionally...*,1
$3500 to look like a high-tech homeless person wandering around hallucinating.,1
So you can walk around watching videos and ignoring everyone around you. People are already too unaware of their surroundings when they are walking around.,1
This tech will be in your RayBans within the next decade and you will be able to buy them 60 a pop at the gas station.,0
Take a Subway Back to Close The window,0
"The atomisation of our society is complete.
Oh, and say goodbye to your teenage kids.",1
It's honestly creepy how everyone on the subway just starts secretly filming him.,0
man what happened to flying cars and shit in the future this feels more like wall-e and shit,1
"When the true beauty of the world has finally left, and we've lost sight of reality, at least we will have Apple Vision. The WALL-E existentialism is really hitting in 2024",0
"What an easy way to get mugged, while you immursed in your virtual world.",1
"The title ""this is the thing"" was never shown. What is ""it""?",0
8:34 Sounds like a new drugs experience,0
that man was NOT getting of there. he was moving to another subway car,0
In a couple of years they will be like contact lenses,0
"But if we’re overwhelmed with information using our smartphones, why would we want this?",0
That’s a good way to get jacked quick on the streets 😂,0
Why does he look like a minion tho 😂,1
Welcome to black mirrors season one,0
This fucking  crazy casey omg!!!,0
1 step closer to Ready Player 1.,0
imagine doing that on shrooms,0
со стороны вглядить как торч солевой а так прикольная вещь,0
It looks like ready player one,0
Pined screens is nice to be coupled with GPS you could pin screens at any place in the world at real time or previously at home.,0
Just loved this,0
Eye contact R.I.P,0
So the future is us all stumbling around like drug addicts.,3
"Apple has turned the Earth into a virtual world, haha!",1
i tried making this tech(not a big company tho) and they should just be able to switch on tracking while moving. apple devs are probably car brained,0
"I was actually talking about the fact that information is being transmitted around us and through us 24/7 with my 13 year old today, he couldn't quite grasp that. This product shows it is possible to actually interact with it in a real world scenario instead of stopping to look at your phone every 5 minutes, it enhances whatever part of the world you want it too.",0
*Coughs* Accel Wolrd,0
"the crazy thing is that this is just the minimum viable product apple was willing to release, right now. its not neccesarily the best apple can currently produce",0
is that an iPhone 5s ?,0
10:26 thansk,0
Watched in 2024!,0
It seem not good for me 😂😂,2
im completly against this type of technology even tho i grew up with it,1
"When Apple puts these into Schools, the kids are FINISHED",0
This is terrifying.,1
This is quite sad tbh,1
No! Please no! We need to stop before its too late.,1
"This dude looks like Shawn Pen and I can't get over it. I can't watch because it makes me realize we are in a simulation and there are so many avatars we can pick from. Even if nature is the operating system there is still only like 16 types of people you see in all Cities when you travel, and nothing is different. This person is an example of this and its scary to look at them.",0
There are definitely a lot of dinosaur in a donut shop.,0
Average Black Mirror episode,1
"Lol idea is cool, just look so weird when wearing it in public though.",0
Your like a walking Robo Cop 😮😮😮,1
Businesses will have VR advertisements that only people wearing these can see.,0
Yea walk around with a $5000 blindfold on in a city known for broad daylight robberies. Brilliant,1
Apple choose a wrong way...,2
"If that is the future, tnx but I am out. I am fighting against present, there is no money in this world that would make me isolate myself even more from reality while looking like a clown in the process.",1
“The butterfly is on my donut” sounded like Joe Biden,0
"This is so sad and pathetic it’s beyond words. If people don’t know how much this technology will create a world of sick people walking around looking like they are insane and having no connection to their own humanity, we are doomed. Why did you run all of those marathons and inspire so many people if this is the kind of world you want to live in? Wow. 😢",1
apple stock ✅,0
this makes the entirety of black mirror look like a story written by an edgy 13 year old on wattpad.,1
I wonder the main bam of this video🤔,0
"Riassunto del Video
Il video sembra essere una sorta di recensione o analisi di un prodotto non specificato, presumibilmente un dispositivo di realtà aumentata o una tecnologia correlata. Il narratore sembra condividere le sue impressioni e le esperienze personali mentre utilizza il prodotto, discutendo delle sue funzionalità e delle possibili implicazioni future.
Articolo in Tono Professionale
Analisi del Prodotto o della Teoria Espressa nel Video
Nel video analizzato, il presentatore condivide le proprie esperienze relative a un dispositivo di realtà aumentata non specificato, fornendo un'analisi approfondita delle qualità e dei difetti del prodotto. Tuttavia, data la mancanza di dettagli specifici sul prodotto o sulla teoria trattata nel video, fornirò un'analisi generica delle potenziali qualità e difetti di un dispositivo di realtà aumentata.
Qualità del Prodotto
Esperienza Immersiva: Il narratore sembra essere entusiasta dell'esperienza immersiva offerta dal dispositivo, sottolineando come abbia dimenticato di guardare attraverso le telecamere e gli schermi del dispositivo, percependo ciò che vedeva come la realtà stessa. Questa qualità evidenzia il potenziale coinvolgente della realtà aumentata.
Interfaccia Intuitiva: Viene menzionato come il dispositivo consenta al narratore di interagire con vari elementi digitali in un ambiente urbano, suggerendo un'interfaccia intuitiva e flessibile.
Potenziale Futuro: Il narratore esprime un forte ottimismo riguardo al futuro della realtà aumentata come interfaccia per il calcolo, suggerendo che questa tecnologia potrebbe rappresentare il futuro dell'informatica.
Difetti del Prodotto
Prezzo Elevato: Il narratore menziona il prezzo di $4,000 del dispositivo, sottolineando che potrebbe non essere attualmente giustificato data la sua qualità attuale. Questo potrebbe rappresentare un ostacolo significativo all'adozione diffusa della tecnologia di realtà aumentata.
Limitazioni Tecniche: Viene menzionato come il dispositivo possa presentare limitazioni nell'uso in determinati contesti, come la difficoltà nel mantenere la connessione o il tracking durante il movimento in ambienti urbani o affollati.
Conclusioni
In conclusione, il video sembra sottolineare il potenziale emozionante della realtà aumentata come futuro dell'informatica, evidenziando al contempo le sfide attuali legate al prezzo e alle limitazioni tecniche. Sebbene il narratore sembri entusiasta delle possibilità offerte dal prodotto, resta da vedere come queste sfide verranno affrontate nel futuro sviluppo della tecnologia di realtà aumentata.
Se necessiti di ulteriori dettagli specifici sul prodotto o sulla teoria trattata, ti pregherei di fornirmi maggiori informazioni in modo da poter fornire un'analisi più dettagliata.",0
This will fuck people up for generations,1
Enabler,1
Why I think people are going to be push by a bike or be robbed because your vision is blocking by a video 🤔.,0
bro that poor guy at the subway thought he was caressing balls on his vr,0
Apple Vision Contact Lenses,0
Gives the expression you see 6 i see 9 more depth.,0
Why everybody that uses APV looks like Martin McFly Jr.?,0
alright this is gonna change pokemon go,0
They live tho,0
Pokémon go please available on this!!!,0
"On the point of simulation, if a child for 10 years have not seen anything like AR, she would think it’s reality.",0
This item is a mana for pick pockets.,0
Pretty brave walking around big city with $3500 goggles!! 😮,0
Everybody is going to look like a cyborg in 10 years when prices drop and the goggles get a bit smaller. Can't wait.,0
"Someone please save us from this insanity. Yes, you looked ridiculous.",2
This future scaresbthe shit out of me...too much disconnection.,0
When you are not interested in tech but just want attention,1
So sad...😔,0
The open mouth with the pinchy hands is fucking comedy gold.,0
"It's so fortunate that the Vision Pro is so absurdly expensive.  Otherwise, we'd see Vision Pro-wearing nerds running around in public.",1
"Revelation 13:16
16 And he shall make all, both little and great, rich and poor, freemen and bondmen, to have a character (also translated as: mark) in their right hand, or on their foreheads.",0
📈,0
This is horrifying. I hope what you are describing never comes to fruition.,2
Everyone who uses this needs to wear the safety vest.,0
Why would we want that tho,1
6:46 😂😂😂😂😂😂😂,0
"Once again, people with poor eyesight are left behind tech wise 😭",0
Congratulations I got sick watching this,2
One step closer to Wall-E,0
Thats scary,0
Too much satisfaction to where normal life becomes far to boring increasing false happiness.,0
There's nothing this device could do that would make it worth walking around looking like an absolute melt,0
Goggles no helmet crazy,0
"Isn't that sort of the definition of ""insanity"": being in your ow world? :))",0
Meanwhile our youth as never suffer more from depression than in today’s society,0
Glassholes V2,0
How long dose the battery last and is it heavy or could you wear it all day?,0
This is it,0
I get motion sick watching this video. Are there other people experiencing this?,0
He still making videos,1
So you need to stop walking or driving to text 🤣,0
"It's too big and bulky looking. They're going to have to reduce the size, make it less conspicuous, and lower the price for it to seriously become mainstream.",1
"whoops, there was a window in front of that bus, is what you woulda said but u died",0
"Whats the point of these? It'll go down the same road as 3DTV... the price point alone means it's not an option to the majority of people and as ""newer and better"" models appear the price is only going to go up..",0
The one thing no one will say is that it’s worth it that is it’s worth $3500,0
I'm confused. Oculus quest has existed for a while now but why the heck does everyone in america seem to think this is the greatest thing since sliced bread?,0
I thought Casey would have more integrity than to watch a Mr. Beast video lol.,0
The end of the independent mind!,0
"*Meanwhile, me and my dumb phone..* 🥰",0
guess you don’t have to take acid anymore lol,0
The future is really terrible. 😂,3
Don't dream it. Be-e-it!,0
The price point is just plain stupid.  Most people cant afford it.  I can definitely afford it but dont think its worth the money.,0
"'There is a butterfly eating my doughnut'. Casey Neistat, NY, 2024.",0
It bothered me that he was pressing every key on the keyboard when he could just look at each key and pinch his finger or use speech-to-text lol,0
Pretty soon there will be contact lenses in stead of the big glasses.,0
this really feels opressiv like people watching you poop,1
"How can people think this is what we need... like I really don't get it.
Why would anyone need this.
This goofy stupid type of progress we have nowadays really makes me sad.",1
watching a youtube video on a youtube video,0
Fu*k virtual world. Live real world!!!,1
We are the arbiters of our own destruction.,0
"I don’t think this thing should be allowed to be used during walking anything which relates to moving physically 
It’s dangerous",0
thought that was skrillex lol,0
Just shot it again with travel mode on man,0
They fucked up on that long ass cord wus sup with wireless 😂,0
Aka google glass,0
👍.,0
Yall really think this is ground breaking but there is technology the military has that makes this VR look like child’s play smh.,0
All Samsung has to do is make sure you find it when it's lost.,0
All Samsung has to do is make sure you find it when it's lost.,0
Noooooo not MrBeast,0
I like the awkwardness.,0
Whats next… albion 😂,0
"thats cool, but next gen will be better",0
Your previous sunshades looked better,0
"Kinetic movement aka movement, like the 1 pushup you have to do with this,comment",0
Me being broke and still watching the video,0
Jello Biafra.,0
Battery capacity too small,0
Anyone else wondering how he is showing us what he is seeing,0
Why have Casey as Wild Product development Director? Here is the answer! 😂,0
Who are here after watching this on flying beast channel 😂 hit like ❤,0
someone was driving a tesla truck while using the apple vision pro so does this video debunk that and he was just being a mime for publicity stunt?,0
It does not work on the plane. Recommend you edit video as that’s misleading.,1
"Ridiculous !
The 2 have Got to stay separate",0
Id buy it when it becomes in a size of a sun glasses 👓 otherwise doesn’t worth it,0
Scary 😨🤡👹,1
So many people are going to get robbed.,1
Time to Say Good bye to technology,0
🎉🎉🎉,0
Giacca da carpentiere e Apple vision pro,0
Casey is a Cyberpunk NPC,0
It’s the matrix,0
All I can see is Marty McFly Jr.,0
This is scary,0
Why do we need to watch YouTube in the middle of time square?,0
"pair this with a neural link, and it's over for reality",0
"I miss my childhood! No cell phones, no internet, no youtube, nothing but only real relationships and real life! What is next? 🤔",0
How to be a clown for just 3500 dollar 😂,1
I can assure you that I will never look like an idiot walking down the street with one of these on. People need to chill out and get off tech more not the other way around.,0
“That you look like an idiot for wearing them in public”. Given the obscene price of them it won’t be long until you get mugged!,1
7 mins in and still cant see the point of these goggles 😂,0
The Chinese versions will soon flood the market.,0
Scuba Steve,0
Does it need WiFi?😂,1
"That outside perspective of Casey waving a donut around in the air just going ""The butterflies are eating my donut"" was hilarious",1
I don't trust people enough to wear this in public.,0
It's hard to manage brain 🧠,0
Riding around on a boosted board and using an MR headset is beyond stupid and dangerous.,0
God forbid this is our new reality. I'm literally downgrading to a dumb phone. This is worse than Black Mirror.,1
The thing about this is you think social interaction didn't exist any more this will be the death of society. Honestly this is bad.,1
he bites human ears forsure 😂😂,0
accident accure easily 😂,0
"But, do we want to be robots or Human Beings ? Is anyone still awake in the midst of all this shit or do you take on everything they throw at you ? Please let us know.
Greetings from Italy",1
4:13 is that guy ok? hyper anxiety over reacting syndrome? 😮,0
If you though people were annoying because they stopped randomly in front of you now…..……..lol,0
"Naaah... these googles had been trying to be the future since the 80s, so realistically, they are the past, and you can see they still look the same. No matter how much money they waste in marketing, it will be still the same, not... the future. In the future you won't need any googles...",0
1:20 💀💀,0
I see some new Darwin Award entries coming very soon…,1
"is this why we humans were evolved on this beautiful piece of rock just to restrict our senses, manipulate our brain and look hilarious typing in air?
i guess we can do better than that?...... right? i don't know where this is going but this doesn't seem so great...",1
ok,0
This guy is a psychopath if wants this to be the future,1
I’m afraid the world has started to leave me behind.,0
When the movie WALi becomes reality.,0
You know apple made it again when mew yorkers get crazy about it in the streets,0
I'm not impressed with the limitations. I'll wait for revamped.  Far as the text and typing.  Uh no.  😂,0
2025 or 2026 will be full of Apple Vision Pro kids,0
“Apple Vision Pro kids” about to replace “iPad kids”??,0
How to get robbed,1
I hope this is not the future,1
Is this real???,0
"I would say if you can get the inhabitants of NYC to stare, stop and maybe even point, you are UNUSUAL. However the elderly (includes me) among us remember when we used to be surprised at people with Air Pods seemingly talking to empty spaces. Well, it beats Elon putting chips in our heads and running updates 24/7.😉",0
Imagine what it did to your internal brain?,0
We live in a simulation.,0
Awesome Video!  but not for me,0
Guess Apple's gonna say it invented windows,0
"Hey, I just figured out how to get my kids away from their dang iPhone.  
Go figure ~",0
This is just Google Glass on steroids.,0
I'm adding 1 push-up everyday for a year,0
"2:00 watching a Mr. Beast video in the subway station? wow. That's new? 
Come on. 

All this is is conditioning for people to be fully immersed in tech ALL THE TIME and when the lights go out and the grid goes down you will be totally a slave to the powers the be. Don't fall for it folks",0
We have to resist this shit a little bit..,1
But if nobody buys them it will flop,1
If he didn't have to vision pro no one would pay attention to him. A society without love but hypocrisy,0
so how many years until they don't look stupid?,0
No thank you. This is my idea of a nightmare. I want to be more connected to the present moment not less.,1
Sorry Casey you looked like a crazy person in public.,1
This is like watching an emo kid that never grew up,0
People are gonna be even more socially awkward,1
Buy them don't open them resell them in about 5-10 years you'll make bank!!!,0
This guy is still alive?,0
"people blocklist filter incoming in 3,2,1,...",0
Huge distraction,2
HUMANITY HAVE LOST ITS REALITY!,2
"I hope the companies will see that and genuenly start a new revolution, dude i can't even imagine integrating this with AI and how it will look in next 10-20 years. 
That fact that you said this will probably the worst in their line up, let that sink in for a moment.",1
"It looks incredibly awkward and stupid, and it honestly looks like a prototype, not something you can actually use. But it will be interesting to see a third or fourth generation of this thing.",0
Welcome to the zombie land...,2
Acid tab is much cheaper,0
"I know there are good aspects to it, but lately I could only see the bad sides of such inventions. I am tired. Tired of constant technological developments. We are just getting further and further away from each other and ourselves...",1
Prison Planet 2.0,0
Vision pro is old technology lmao that's what no one at Apple tells ya,0
I can imagine how useless this would be for mechanics,0
He looks like bonno,0
"Sorry... but Meta's stock has been almost doubling eversince... While Apple's going down. For a $3500 product, it's not much of a technological leap from Meta's offer. Sure the camera and screen are better, but isn't that a consequence of a much higher price?",0
bro you are so loud with taht vison pro it is almost like you are screaming,0
Even more burn-outs incominggggg,0
I’ll hack it if they turn them into actual glasses I’ll build programs too help the military,0
The next step is an implant.😔,2
in 10 years those are going to be 80% cheaper,0
"This is what is gonna make me a boomer, I hate them",1
This shit make it so ez for weirdo’s now,1
"It's crazy because in 15 years, this thing will look so old and outdated",0
👇flying beast army like here 👍,0
"His Muther Was A Mudder, His Fauther Was A Mudder. Apple Vision Pro , Looks Great, But Would Look Better With A HAT!!!!! To Keep The Rain From Clogging The Thing With Mudder............. (Smiles)",0
You need a snorkel,0
"Kids these with thir Tic-Tocs
Meanwhile...",0
I don't think I want that.,1
"Standing at a subway stop watching a video is a special experience? I find that rather sad, to be honest.",0
