Comment,Likes
"It would be interesting to test this subway topic by standing paralell to the subway acceleration direction, instead of being perpendicular. I would assume it will affect differently the accelerometer readings, but anyway, I know nothing about this so, no clue if it works differently or not :D",0
you're a genius.,0
"Wow. somehow after watching you use it in public, I dont have a great feeling about it... it seems as we are isolating ourselves through this stuff more and more. But from technical perspective its amazing!",179
Remember how in games (like FusionFall) characters would just stop on streets and start typing and doing their own thing when they’d have menus open? The climbing up the stairs of the subway shot reminded me of exactly that.,106
"The age old issue of ""Sound vs Metro"". I wonder how the Vision Pro's speakers hold up against that onslaught?",0
"life is going to be so funny while walking around in a few years when theres a ton of people with these on. Especially when future versions come out at a more affordable price, its going to be a whole new world.",0
"Been watching you for years man love your style! Definitely the type of review these needed, also I didn't see if anyone else mentioned but the music fits the video so well. Bravo.",18
I'm terrified. someone please take me back to the early 2000's with my land line home phone and family computer in the living room.,52
May not see this comment 😂but you really inspired a lot of creators . I’ve been watching you since I was 14 I’m 22 now I started youtube because of you . If no one gave Casey his flowers yet well I will best creators of all time .,0
"Love your jacket, looks apart. 😉",0
"New York is a great place… I’m happy Casey is back and show casing it in a way people outside of the city rarely see. People are nice, and kind, and curious, and smile, and laugh, and it’s just magic forreal",70
I know it was a while ago but I am still so happy you are back in NYC!,262
have you tried xreal glasses?,0
This is gonna make the New York experience even better,0
"Great video Casey, glad to see you're doing well. I enjoyed watching this review. But when you sat down in the office I suddenly thought you saying ""Happiness equals reality minus expectations"". I just want you to know that I think about that saying everyday and it helps me bring myself back up to reality when I'm feeling down on myself. Thanks for that. Have a great year my friend.",28
"its a bit of fun for a video but imagine everyone running around with these things, it's bad enough no one talks to each other now being phone zombies",749
"Unrelated topic: Incredible NYC still seems to have metros from the 1970s!  I like retro, but not for the daily commute. 

We used to have similar metros in Amsterdam for traveling from CS to the Bijlmer.  But they have long been replaced by modern nicer equipment. Why isn’t the US or in this case NYC investing in new trains?",0
What if you wear glasses? How does work with that?,1
that opening shot alone . instant classic lol. only thing they’re missing is the signature spray paint !,106
"so cool to see this shown in the wild.  i’m no tech visionary but i’m struggling to see the use cases right now beyond entertainment + business for most people. it’s incredibly challenging to be present in public already with our phones, headphones, heads up displays and big screens in cars.  i just can’t imagine integrating this into life outside of controlled environments and am really curious (concerned?) about what impact that will have on both the user and those around you in terms of human connection. there’s already so many ways to “check out” at home and in private - mixing this tech in public just feels…wrong?!",38
does it have an airplane mode?  Where are the antennas located?,0
"We always ask if we can do it, but we never stop to think if we should.",0
"This is a great video Casey! I appreciate you testing the real world function of this device. I found it interesting that your reaction at the end was much different than thoughts while watching. My thoughts were that maybe we're headed down a path that will leave us more isolated and separate from one another. Is it ""boomerish"" of me to have an inclination to abstain from this type of tech?",744
I think this is a very unique insight into how public interaction in a real world would irk with devices like the Vision Pro. Most reviewers are designing at home and reviewing the device while this offers a glimpse into what it would mean to actually put the device through its paces. Very unique. Good work!,33
"Went for a demo session, amazing
glad I own the stock",1
Fixing posture but screwing eyesight even more 😂 cool tech tho. Reminds me of cyberpunk netrunner,0
"I come from southern Italy, and I visited New York for the first time last week. I must say that this video is fantastic and it brought back the same sensations I had while exploring the city. If I had met you, I believe my reaction would have been similar to the guy who encountered you in Times Square. Amazing video as always",39
feels so dystopian,18
the only review that matters :D,0
you look cool dude fr,0
"One of the best videos you have ever made. So fun and interesting, a wild experience to watch + a great story.

I loved the mkbhd videos and watched them all but your 10 minutes showed the true value of it in a way even apple cant do.",20
"gotta say, I have never commented on any of your videos, but this is hands-on the best review for the vision pro",58
do you need cellular data to use it anywhere?,0
Very robust tech demo. Best irl usage I've seen of the gadget.,0
"As someone who has been studying electrical engineering for the last 4 years, this video is fucking awesome. I can’t imagine what the future holds",37
"2:43 ""I get off here... Enjoy your adventure!"" was so genuine and sweet.",2727
I will get one of these or something similar for sure in the future. It has pretty much everything you need for home and travel needs of entertainment and work,1
"The verge review had a great explanation why reviewers are underwhelmed, they review what's IN the box, not the promise of what's to come. Casey described it as peeking into the future of computing, what they're selling right now is a just that. The true benefit of releasing this tech to the public early is that it gets developers thinking about designing for the future, and they get real world feedback from the early adopters. It is cool to see Apple entering this space, can't wait to try it myself!",10
"I was waiting for you to say ""There I was sitting in the middle of thousands of people in times square and I was simultaneously connected and disconnected from the world.""  I can't wait to see people use these while walking, biking, driving....",162
"Fun fact, if you turn on pointer control inside of the Apple Vision Pro, we can see where you’re looking and it makes it so that it’s harder for the viewer to notice the low quality rendering in the places where you’re not looking.",0
"The price is INSANE . It is a good office device combo. And for entertainment. But use it on a street or even metro - that is dangerous. Someone can steal it from you, the user can get into accident, etc. We as humans cant even properly/safely use mobile phone while we walk on a pavement without stumbling into something because our attention is divided. With this it is several times more dangerous. For home use awesome. But the price khmm. P.S.-I can bet someone will use it while driving with a car...and will get into trouble.",1
Such a kind man at the 2:28 mark. Most people are good. Spread love ❤️,63
I kid you not when I did the butterfly thing I felt it land on my hand. They said apparently about 30% of people have the same experience. Wild.,458
Used the go pro for most of the footage. It did ok.,0
finnally a new glasses!,0
"I miss casey’s tech vlogs so much, so glad they’re back!",95
You the man Casey,617
I wanna have one to but dont know what to do with it 😂,0
6:47 if you were to say that without those on people would think your on some strong stuff 😂😂😂,1
"Also, you stopped on the stairwell typing, was gold. I laughed out loud.",44
"7:25 - “I thought that would be funny.” It really was 😂 most Casey video ever, super entertaining use of the new tech!",68
the motion tracker thing works with acceleration. If your acceleration is zero for all effects you're still. So you can use it in an airplane for as long as the airplane is not accelerating,0
I wonder if it works in a car or something besides a train - that would be so cool for road trips as a passenger,0
You can tell that you are an incredible filmmaker. I mean that is like such a left field way to do a review. So good.,28
this is by far the greatest and possibly most important video about the Vision Pro that i’ve seen so far. thank you for creating it,95
"Looking at 6:39, I guess my Grandma has Vision pro inbuilt because she sometimes see stuff that we can't.",0
This is so cool 😂,0
"Funny you mentioned Marques' review, which was a masterclass, but you captured the remaining insights that he hadn't. Impressive work.",24
"Love your interactions with the precious humans of NYC. I have no desire to replace the authentic experience of walking thru cities and nature, but you still made the vid a cool thing to watch! Cheers! JB",34
How's your peripheral vision with them on?,0
6:38 Revolutionary.,0
"this is the definition of thinking out of the box, setting yourself apart. what a fun, inspiring review. Apple you owe this man a check.",88
"9:30 What you're describing right there, is a real dystopia. Imagine growing up in a world, where every morning you wake up and put on AR glasses and live out your day, then take them off before you sleep at night. Living your entire existence through a screen. Imagine, living in a town or city, but having never actually seen it. Having friends, but having never actually seen them. As seeing them through a screen, is not really seeing them. Sounds like absolute hell.",6
"Us looking at this technology is probably how people felt back then when cellphones/computers became a thing.
This is so cool and scary all at once",0
Magical and terrifying.,2
"What I'm really impressed with is your overall like-ability. Thanks for existing so loudly, bro.",52
"Casey is literally the PERFECT guy to comment on this tech. 

I think this video is so much more insightful into what this device MEANS for society than any other tech review video I've seen, and I've been working in this space for a decade. Casey ACTUALLY gets it. He's understands technology like Steve Jobs did, in the intuitive way, not just by numbers. What a breath of fresh air. 

This video is one of the best tech review videos I've seen in a while. While I love MKBHD's production value on his videos, Casey puts us into the perspective of, basically, the real world. How does tech actually influence or augment our lives, how does it fit into culture. I haven't watched Casey in years, but this was so refreshing and divine to watch.",119
There is is literally a button you press in the control center and it switches to travel mode so stuff doesnt move when you move,0
No one can tops a casey neistat video. True OG of the youtube,0
"Thank you!  This is the review I was looking for.  This review reveals purpose, reason, and the future potential of Apple and technology in general.",8
I love how you just didn't care what others thought as you filmed. I wish I could do that. I mean I guess I could just do as I pleased but I loved this video,87
that iphone 5s on your right ♥,0
The music in this video is top tier,0
This looks utterly dystopian,428
The flow of this video the explanation of your experience in this video was seriously top tier. All the questions I had and thought about are answered.,69
It is the first for headset not just for gaming.,0
"Heavy rain AR glasses, can't wait",0
The kids looking at him at that doughnut bar and smiling - such a great cut as I would have imagined this myself how I would look like seeing Casey. I will try to get some borrowed... but wait some iterations down the line to buy some... thanks for the video,61
"This is the review of the Vision Pro everybody actually needed...as always Casey, you rock!",36
It is a game changer. We live in a transformative era. In 10 years no mobile phone will be needed🙌,0
The guy on the street was so excited 😂 it was very refreshing seeing someone not being cynical or have a superiority complex,0
"You look like Back To The Future Kid 😂, i love you Casey!❤",217
"So why I love Casey, because he has his own approach of how to make videos. That's why Casey has always been and still is the best youtuber, he has pushed YouTube to this level. When I met Casey in real life, he pleasantly surprised me with what an energetic and interesting person he is🚀 

The idea behind his video seems simple, but his pitch is very unusual🔥🔥🔥",73
Mind blown 😳,0
"For those of you about to venture into AR/VR, get ready for the very weird feeling of taking your headset off after being in VR for a few hours to a dark room. Case speaks truth to how your mind adapts to being in VR and it feels really weird to take off after a long session",0
I watched nearly every Vision Pro video by now... This has been the most valuable one! Thanks Casey 👍,24
You took us there! I can see the future for sure. And your excitement was palpable. Really enjoyed this.,8
I find it so funny when you say to people ur to much on your phone 😂😂 they always come up with bs,0
Question when you wear this all day people need glasses  much faster in the future?,0
"So great to see you again!  Great video and take on the new device. I understand that feeling completely. I haven’t felt this way about a device since the announcement of the first iPod. So many similarities. At the time, millions of mp3 existed, took batteries (kids used to steal the batteries from the calculators in class) and no player cost more than $100. Then the iPod dropped. Same happened when the iPhone dropped. CNET’s review was hilarious. Claimed it was dead on arrival, no physical buttons, no stylus, no upgrade able memory, and too expensive. Now there’s a whole industry completely saturated and nearing the end of its innovation. This is the first headset I have seen that gives a glimpse into the possibilities. Just having control over the image projecting to others has huge implications and possibilities. I’m so pumped, seriously. You nailed that feeling of excitement in your video. Beautiful work as always. Loved it!",15
Only 1:20 into the video but Casey’s refreshing style and down to earth mentality already makes me smile and happy 😂❤🎉 Keep it up. Always great to see how positive and friendly react to Casey 🙏 tolerance is what the world needs right now.,9
Did he return the vision pro device?,0
"interesting dailies content, keep up on this kind of videos lol 🤣",0
Hey great video! Best review of the Vision Pro I’ve seen. I was thinking it wasn’t for me but I can see the appeal now.,10
"Casey, I love the video and I’m glad you came to a similar realization that I’ve had regarding computing in the future! I HIGHLY recommend the book “Warcross” by Marie Lu as it has a little bit for everyone while going deeper into the future that I believe you’re talking about, if your not really into video games, it might be a bit of a stretch to read, but it’s honestly my favorite book that I’ve ever read. 
Have a good one!",7
"I think once batteries and all the other tech here get WAY smaller and this is just a pair of glasses, they'll be sweet. I think Apple should have shot for just entirely AR, less immersive glasses first, but they kinda dove in the deep end which I guess is fine.",0
I had the same with Quest3,0
I love this review and the take at the end. Most of all I look forward to seeing how they shrink it down to the practical glasses size and how we solve all the problems required to accomplish it!,5
Most relatable review I’ve seen on this “$4000 ski goggles” yet and that is no easy feat with all the 1000’s of reviews out there. Way to stand out from the crowd Casey👍🏾,65
Use travel mode to keep screens stationary,0
Do they come with data or does it just piggy back off of phone data?,0
"This is possibly better than a full review, since it shows whats its like in your daily life. 
A lot of great moments in this video
Awesome video!",41
2:43-2:53 made me burst out laughing. I feel like the still frame with his hand sticking out is the average experience.,48
"I clicked on your video because I think you are cooler then Marcus. Love your videos man I'm a big fan 

I love you too Marcus 🩵",0
"Think about the first computer you ever saw and think about computers now. When I saw this, I felt the same way",0
"What a great review this is what i wanted, a real perspective of things.
This reminds me of when people started talking in microphone headsets in public and everybody looked at them like who is he talking to, and this genuinely scare me, this is the last stop before we go fully immersive and wave goodbye to human connection.",11
"Hands down one of the best videos you made lately, Casey.",29
Good review! The future is now!,0
"8:15 What you see is reality.  Technology like this enhances reality. Reality is comppsed of everything you experience through your senses, and what ""sense"" your mind makes of it. Just one way of looking at it.",0
"Casey is think this is genuine modern art. The shots and editing made the video come together really well. 
One of your best I’ve seen in a long while. Thanks for the laugh 😂",117
World is going to be just another Black mirror episode,23
I assume it comes with the fluorescent safety jacket to prevent you from dying in traffic?,0
"do they night vision ,thermo or xray vision?",0
"I don't think I would ever have a need for these use conditions, but I'm really glad to see what they would be like if I did! Thanks!",9
"You taking these AR ski goggles out into the real world really gave us a glimpse into what the future of television, the internet, and interfacing with technology. AR glasses that function like these Apple Vision Pro's would be a game-changer. Great video Casey!",35
"6:30 this right here is most amazing and funny moment  with today's technology 
The is the [Foreigner Vlogger visiting another country]",0
"I don't know why you didn't discover it, but there is a travel mode that tracks the screen throughout the moving journey in that subway clip.",0
Casey is back!! Loved ur vidoes back high school and still love your vidoes after 2 kids now watching together!,11
"I’ve used cheap oculus with 2k resulution with games like no man’s sky and the immersion is insane, it’s one of those things where you have to try it to understand. I can’t imagine how amazing the Vision Pro is.",15
You can lock your windows to stay in your perspective while moving,0
You should have enabled Tracking Mode,0
"Very big ""Classic Feeling"" vibe in this video, Love it!",25
The best review ever for this product ever on YouTube. And I think he just made history with this video! Period!,104
Everybody saying that it doesn’t cost 4000$. But it’s amazing you can take a small piece of future,1
I'm envisioning a future with loads of Pokémon hunters on the streets when these things become smaller and more affordable and honestly I hope I will be one of them instead of being the old grandma hating on all these changes cause I think I'd be happier with my charmander beside me.,0
"Wow, what a remarkable video. In real time, Casey evolved this piece from a ""funny reactions to weird AVP nerd"" story to something much more profound: ""the AVP provides (surprisingly) a decent look at the future of computing."" Bravo. This makes other AVP reactions/reviews appear shallow. Bravo.  🔥",26
"Fantastic video Casey. I love your perspective showing the awkwardness and absurdity of the present versus the future potential.

My wife also made a great observation about her fears of people never being able to disconnect.",14
What is this jacket? Similar to rail station staff at London Waterloo.,0
Just shows you that we are truly in the end times. Another step farther away from reality into total 'disconnectedness' with your fellow man.,0
"This was the Vision Pro review I was waiting for.  While I appreciate other’s review, they all feel very safe and in a controlled environment.  As someone who lives in NYC, I appreciate you taking this to the next level which is the realistic chaotic day to day use in the real world.  Thank you!",8
"I always love watching Casey interact with New York, and watching New Yorkers interacting back to him, the love both ways it’s always amazing to see. Always makes me want to visit",14
"No one:
Goggle guy: “The butterfly is eating my donut”",0
Ever thought of going for  a run with that thing on casey,0
Casey killed it. This is the kind of review/narrating that has been making him so unique and popular amongst Yters.,17
"Best review so far, great job thinking outside the box!",7
"9:20 

Elon Musk: ""..already way past that with neuralink...""😂❤",1
Does it come with flippers?,0
"These types of videos show such an important part of the picture. What the (future) real world experience of owning one may become. Hats off, this was fantastic.",30
This is by far the best non-review review of this thing. Casey is such an incredible storyteller,16
So everybody can be living in their own independent reality side by side to each other,0
Casey can try Apple Vision Pro where you visit some country.,0
"Casey just finds so many different and inspiring ways to enjoy things. I would of never imagined using this thing
and walking around a city with it on.",31
"I love it! But the scare thing is, I scare people locked into their phones back to back to back. I'm just thinking about what happens when they are wearing these. Or even scarier when they drive with them on. Phones are bad enough",19
"I can see people experiencing derealization from this, similar to what you can experience when taking drugs. I'm scared for what's held in the foreseen future.",1
"Jordan: ""No - 'thasnk' you Casey, my pleasure"" 10:26",0
"I don't know how this works, but literally every of Casey's videos has this magical touch to it. Makes me really appreciate the king. To the Vision Pro: It seems to be as amazing as it is kinda scary to have products like this entering our lifes, changing how we perceive reality. How we interact with our surroundings. It truly is surreal to be a Sci-Fi fan currently to have this mindboggeling technologies really at our fingertips - assuming you are willing and able to pay those HUGE prices. Future truly is here and I'm looking forward how the Vision Pros change the VR market and which crazy others products will be the result of it",47
"I would not want to experience it like this at all, but I love knowing how it would work and seeing it demonstrated. This is a very important video for tech in general",21
"2025 :
Covid: i sense something dangerous
Vertigo outbreak : get out its my turn",0
We need a new studio tour,0
I think the funniest part was waving your donut around with the butterfly and people watching you😂😂😂,24
100% the best review iv seen of this thing. A real review,9
"Buying in to the apple watch 1 honestly not too bad..  But buying in to this, is absolutely ridiculous.  I'm waiting for the vision pro 8 at least before I drop that kinda money lol",0
lmao this was one of the best of Casey's videos in years! His social anxiety level is in the negative,0
"Bro. I am wordless I've got nothing to say but I really enjoyed Casey's experience of the Apple vision pro... I felt as if I were with him. Thanks, Casey.",15
"I think what everyone forget to say in their review is how lonely the world will become when VR can feel that real. 

We won’t be able to psychologically recover from such a shift. Humans are made for human interaction and this stumps that growth for communities, communication and social skills in general. It’s such a sad direction the world is moving in",49
"Casey, waiting from you to check out bionic lenses , you gonna fly for real",0
It's only the beginning!,0
"It has been a long, long time since I have subscribed to someone for their personality and style alone. Thank you. (This is the first time I've even seen you btw)",18
Real sadness… this is foreshadowing a bleak future… a deeper self-alienated presence… being evermore removed from the other… social awareness slowly becoming irrelevant… pushing more and more people (especially youth) into the arms of despair and depression… mistaking connectivity for genuine connection… 😢😢😢,95
first i watch u videos is 20k suscribe but now is 12m wow 😅,0
The elegance and sophistication of Sofía Vergara's Los Angeles home are truly captivating. A testament to impeccable taste and style.,0
"I understand the excitement around AR, but seeing people walking around with these on their heads reminds me of a show episode, maybe Black Mirror, where a kid was diagnosed with a new form of depression. One where they inundated themselves with so much visual and auditory input from online media that they couldn't regulate their emotions, and deactivating the device they used to view all of this - a wearable - basically flicked off a switch and they'd sit there shy and near catatonic. What I'm afraid of is training ourselves into a syndrome similar to phantom limb syndrome; one where without our phones, we feel naked, and without a window opening when we make a gesture, we feel vulnerable.",76
